clae6,clae3,Actividad
702092,2092,"Servicios de asesoramiento, dirección y gestión empresarial realizados por integrantes de cuerpos de dirección en sociedades excepto las anónimas"
702099,2099,"Servicios de asesoramiento, dirección y gestión empresarial n.c.p."
711001,1001,"Servicios relacionados con la construcción (Incluye los servicios prestados por ingenieros, arquitectos y técnicos)"
711002,1002,Servicios geológicos y de prospección
711003,1003,Servicios relacionados con la electrónica y las comunicaciones
711009,1009,Servicios de arquitectura e ingeniería y servicios conexos de asesoramiento técnico n.c.p.
712000,2000,"Ensayos y análisis técnicos (Incluye inspección técnica de vehículos, laboratorios de control de calidad, servicios de peritos calígrafos, servicios de bromatología)"
721010,1010,Investigación  y desarrollo experimental en el campo de la ingeniería y la tecnología
721020,1020,Investigación  y desarrollo experimental en el campo de las ciencias médicas
721030,1030,Investigación  y desarrollo experimental en el campo de las ciencias agropecuarias
721090,1090,Investigación y desarrollo experimental en el campo de las ciencias exactas y naturales n.c.p.
722010,2010,Investigación  y desarrollo experimental en el campo de las ciencias sociales
722020,2020,Investigación  y desarrollo experimental en el campo de las ciencias humanas
731001,1001,Servicios de comercialización de tiempo y espacio publicitario
731009,1009,Servicios de publicidad n.c.p.
732000,2000,"Estudio de mercado, realización de encuestas de opinión pública"
741000,1000,"Servicios de diseño especializado (Incluye diseño de indumentaria, diseño gráfico, actividades de decoradores, etc.)"
742000,2000,Servicios de fotografía
749001,9001,Servicios de traducción e interpretación
749002,9002,Servicios de representación e intermediación de artistas y modelos
749003,9003,Servicios de representación e intermediación de deportistas profesionales
749009,9009,"Actividades profesionales, científicas y técnicas n.c.p."
750000,0,Servicios veterinarios
771110,1110,Alquiler de automóviles sin conductor
771190,1190,"Alquiler de vehículos automotores n.c.p., sin conductor ni operarios (Incluye: camiones, remolques, etc.)"
771210,1210,"Alquiler de equipo de transporte para vía acuática, sin operarios ni tripulación"
771220,1220,"Alquiler de equipo de transporte para vía aérea, sin operarios ni tripulación"
771290,1290,"Alquiler de equipo de transporte n.c.p. sin conductor ni operarios (Incluye: equipo ferroviario, motocicletas)"
772010,2010,Alquiler de videos y video juegos (Incluye la actividad de los videoclubes)
772091,2091,Alquiler de prendas de vestir
772099,2099,Alquiler de efectos personales y enseres domésticos n.c.p. (Incluye alquiler de artículos deportivos)
773010,3010,"Alquiler de maquinaria y equipo agropecuario y forestal, sin operarios"
773020,3020,"Alquiler de maquinaria y equipo para la minería, sin operarios"
773030,3030,"Alquiler de maquinaria y equipo de construcción e ingeniería civil, sin operarios (Incluye el alquiler de andamios sin montaje ni desmantelamiento)"
773040,3040,"Alquiler de maquinaria y equipo de oficina, incluso computadoras"
773090,3090,"Alquiler de maquinaria y equipo n.c.p., sin personal"
774000,4000,Arrendamiento y gestión de bienes intangibles no financieros
780000,0,"Obtención y dotación de personal (Incluye las actividades vinculadas con la búsqueda, selección y colocación de personal, la actividad de casting de actores, etc.)"
791100,1100,Servicios minoristas de agencias de viajes
791200,1200,Servicios mayoristas de agencias de viajes
791901,1901,Servicios de turismo aventura
791909,1909,Servicios complementarios de apoyo turístico n.c.p.
801010,1010,Servicios de transporte de caudales y objetos de valor
801020,1020,Servicios de sistemas de seguridad
801090,1090,Servicios de seguridad e investigación n.c.p.
811000,1000,Servicio combinado de apoyo a edificios
812010,2010,Servicios de limpieza general de edificios
812020,2020,Servicios de desinfección y exterminio de plagas en el ámbito urbano
812090,2090,Servicios de limpieza n.c.p.
813000,3000,Servicios de jardinería y mantenimiento de espacios verdes
821100,1100,Servicios combinados de gestión administrativa de oficinas
821900,1900,"Servicios de fotocopiado, preparación de documentos y otros servicios de apoyo de oficina"
822000,2000,Servicios de call center
823000,3000,"Servicios de organización de convenciones y exposiciones comerciales, excepto culturales y deportivos"
829100,9100,Servicios de agencias de cobro y calificación crediticia
829200,9200,Servicios de envase y empaque
829900,9900,Servicios empresariales n.c.p.
841100,1100,"Servicios generales de la Administración Pública (Incluye el desempeño de funciones ejecutivas y legislativas de administración por parte de las entidades de la administración central, regional y local, la administración y supervisión de asuntos fiscales, la aplicación del presupuesto y la gestión de los fondos públicos y la deuda pública, la gestión administrativa de servicios estadísticos y sociológicos y de planificación social y económica a distintos niveles de la administración)"
841200,1200,"Servicios para la regulación de las actividades sanitarias, educativas, culturales, y restantes servicios sociales, excepto seguridad social obligatoria (Incluye  la gestión administrativa de programas destinados a mejorar el bienestar de los ciudadanos) "
841300,1300,"Servicios para la regulación de la actividad económica (Incluye la administración pública y la regulación de varios sectores económicos, la gestión administrativa de actividades de carácter laboral, la aplicación de políticas de desarrollo regional)"
841900,1900,"Servicios auxiliares para los servicios generales de la Administración Pública (Incluye las actividades de servicios generales y de personal, la administración, dirección y apoyo de servicios generales, compras y suministros, etc. )"
842100,2100,Servicios de asuntos exteriores
842200,2200,Servicios de defensa
842300,2300,Servicios para el orden público y la seguridad
842400,2400,Servicios de justicia
842500,2500,Servicios de protección civil
843000,3000,"Servicios de la seguridad social obligatoria, excepto obras sociales (Incluye PAMI y ANSES)"
851010,1010,Guarderías y jardines maternales
851020,1020,"Enseñanza inicial, jardín de infantes y primaria"
852100,2100,Enseñanza secundaria de formación general
852200,2200,Enseñanza secundaria de formación técnica y profesional
853100,3100,Enseñanza  terciaria
853201,3201,Enseñanza universitaria excepto formación de posgrado
853300,3300,Formación de posgrado
854910,4910,Enseñanza de idiomas
854920,4920,Enseñanza de cursos relacionados con informática
854930,4930,"Enseñanza para adultos, excepto discapacitados"
854940,4940,Enseñanza especial y para discapacitados
854950,4950,"Enseñanza de gimnasia, deportes y actividades físicas"
854960,4960,Enseñanza artística
854990,4990,"Servicios de enseñanza n.c.p. (Incluye instrucción impartida mediante programas de radio, televisión, correspondencia y otros medios de comunicación, escuelas de manejo, actividades de enseñanza a domicilio y/o particulares, etc.)"
855000,5000,Servicios de apoyo a la educación
861010,1010,Servicios de internación excepto instituciones relacionadas con la salud mental
861020,1020,Servicios de internación en instituciones relacionadas con la salud mental
862110,2110,"Servicios de  consulta médica (Incluye las actividades de establecimientos sin internación o cuyos servicios se desarrollen en unidades independientes a las de internación: consultorios médicos, servicios de medicina laboral)"
862120,2120,"Servicios de proveedores de atención médica domiciliaria (Incluye las actividades llevadas a cabo en domicilios de pacientes con alta precoz, y que ofrecen atención por módulo) "
862130,2130,"Servicios de atención médica en dispensarios, salitas, vacunatorios y otros locales de atención primaria de la salud"
862200,2200,Servicios odontológicos
863110,3110,"Servicios de prácticas de diagnóstico en laboratorios (Incluye análisis clínicos, bioquímica, anatomía patológica, laboratorio hematológico, etc.)"
863120,3120,"Servicios de prácticas de diagnóstico por imágenes (Incluye radiología, ecografía, resonancia magnética, etc.)"
863190,3190,Servicios de prácticas de diagnóstico n.c.p.
863200,3200,"Servicios de tratamiento (Incluye hemodiálisis, cobaltoterapia, etc) "
863300,3300,"Servicio médico integrado de consulta, diagnóstico y tratamiento"
864000,4000,Servicios de emergencias y traslados
869010,9010,"Servicios de rehabilitación física (Incluye actividades de profesionales excepto médicos: kinesiólogos, fisiatras, etc.)"
869090,9090,"Servicios relacionados con la salud humana n.c.p. (Incluye servicios de psicólogos, fonoaudiólogos, servicios de enfermería, terapia ocupacional, bancos de sangre, de semen,etc.)"
870100,100,"Servicios de atención a personas con problemas de salud mental o de adicciones, con alojamiento"
870210,210,Servicios de atención a ancianos con alojamiento
870220,220,Servicios de atención a personas minusválidas con alojamiento
870910,910,Servicios de atención a niños y adolescentes carenciados con alojamiento
870920,920,Servicios de atención a mujeres con alojamiento
870990,990,Servicios sociales con alojamiento n.c.p.
880000,0,Servicios sociales sin alojamiento
900011,11,Producción de espectáculos teatrales y musicales
900021,21,"Composición y representación de obras teatrales, musicales y artísticas (Incluye a compositores, actores, músicos, conferencistas, pintores, artistas plásticos etc.) "
900030,30,"Servicios conexos a la producción de espectáculos teatrales y musicales  (Incluye diseño y manejo de escenografía, montaje de iluminación y sonido, etc.)"
900040,40,Servicios de agencias de ventas de entradas
900091,91,"Servicios de espectáculos artísticos n.c.p. (Incluye espectáculos circenses, de títeres, mimos, etc.)"
910100,100,Servicios de bibliotecas y archivos
910200,200,Servicios de museos y preservación de lugares y edificios históricos
910300,300,"Servicios de jardines botánicos, zoológicos y de parques nacionales"
910900,900,"Servicios culturales n.c.p. (Incluye actividades sociales, culturales, recreativas y de interés local desarrollado por centros vecinales, barriales, sociedades de fomento, clubes no deportivos, etc.)"
920001,1,"Servicios de recepción de apuestas de quiniela, lotería y similares  "
920009,9,Servicios relacionados con juegos de azar y apuestas n.c.p.
931010,1010,"Servicios de organización, dirección y gestión de prácticas deportivas en clubes (Incluye clubes de fútbol, golf, tiro, boxeo, etc.)"
931020,1020,"Explotación de instalaciones deportivas, excepto clubes"
931030,1030,Promoción y producción de espectáculos deportivos
931041,1041,Servicios prestados por deportistas y atletas para la realización de prácticas deportivas
931042,1042,"Servicios prestados por profesionales y técnicos para la realización de prácticas deportivas (Incluye la actividad realizada por entrenadores, instructores, jueces árbitros, cronometradores, etc.)"
931050,1050,"Servicios de acondicionamiento físico (Incluye gimnasios de musculación, pilates, yoga, personal trainner, etc.)"
931090,1090,Servicios para la práctica deportiva n.c.p.
939010,9010,Servicios de parques de diversiones y parques temáticos
939020,9020,"Servicios de salones de juegos (Incluye salones de billar, pool, bowling, juegos electrónicos, etc.) "
939030,9030,"Servicios de salones de baile, discotecas y similares"
939090,9090,Servicios de entretenimiento n.c.p.
941100,1100,Servicios de organizaciones empresariales y de empleadores
941200,1200,Servicios de organizaciones profesionales
942000,2000,Servicios de sindicatos
949100,9100,Servicios de organizaciones religiosas
949200,9200,Servicios de organizaciones políticas
949910,9910,"Servicios de mutuales, excepto mutuales de salud y financieras"
949920,9920,Servicios de consorcios de edificios
949930,9930,Servicios de cooperativas cuando realizan varias actividades
949990,9990,Servicios de asociaciones n.c.p.
951100,1100,Reparación y mantenimiento de equipos informáticos
951200,1200,Reparación y mantenimiento de equipos de telefonía y de comunicación
952100,2100,"Reparación de artículos eléctricos y electrónicos de uso doméstico (Incluye  TV, radios, reproductores cd's y dvd's, cámaras de video de uso familiar, heladeras, lavarropas, secarropas, aire acondicionado de menos de 6000 frigorías)"
952200,2200,Reparación de calzado y artículos de marroquinería
952300,2300,Reparación de tapizados y muebles (Incluye la restauración de muebles)
952910,2910,"Reforma y reparación de cerraduras, duplicación de llaves. Cerrajerías"
952920,2920,Reparación de relojes y joyas. Relojerías
952990,2990,"Reparación de efectos personales y enseres domésticos n.c.p. (Incluye la actividad de arreglos de prendas realizadas por modistas), (No incluye la actividad de sastres y modistas que confeccionan prendas: grupo 141)      "
960101,101,Servicios de limpieza de prendas prestado por tintorerías rápidas
960102,102,"Lavado y limpieza de artículos de tela, cuero y/o de piel, incluso la limpieza en seco"
960201,201,Servicios de peluquería
960202,202,"Servicios de tratamiento de belleza, excepto los de peluquería"
960300,300,Pompas fúnebres y servicios conexos
960910,910,"Servicios de centros de estética, spa y similares (Incluye baños turcos, saunas, solarios, centros de masajes y adelgazamiento, etc.)"
960990,990,"Servicios personales n.c.p. (Incluye actividades de astrología y espiritismo, las realizadas con fines sociales como agencias matrimoniales, de investigaciones genealógicas, de contratación de acompañantes, la actividad de lustrabotas, acomodadores de autos, etc.)"
970000,0,Servicios de hogares privados que contratan servicio doméstico
990000,0,Servicios de organizaciones y órganos extraterritoriales
