clae6,clae3,Actividad
465330,5330,"Venta al por mayor de máquinas, equipos e implementos de uso en la fabricación de textiles, prendas y accesorios de vestir, calzado, artículos de cuero y marroquinería (Incluye venta de máquinas de coser, de cortar tejidos, de tejer, extender telas, robots de corte y otros equipos para la industria textil y confeccionista, etc.)"
465340,5340,"Venta al por mayor de máquinas, equipos e implementos de uso en imprentas, artes gráficas y actividades conexas (Incluye venta de máquinas fotocopiadoras - excepto las de uso personal-, copiadoras de planos, máquinas para imprimir, guillotinar, troquelar, encuadernar, etc.)"
465350,5350,"Venta al por mayor de máquinas, equipos e implementos de uso médico y paramédico (Incluye venta de equipos de diagnóstico y tratamiento, camillas, cajas de cirugía, jeringas y otros implementos de material descartable, etc.)"
465360,5360,"Venta al por mayor de máquinas, equipos e implementos de uso en la industria del plástico y del caucho (Incluye sopladora de envases, laminadora de plásticos, máquinas extrusoras y moldeadoras, etc.)"
465390,5390,"Venta al por mayor de máquinas, equipos e implementos de uso especial n.c.p.  (Incluye motoniveladoras, excavadoras, palas mecánicas, perforadoras-percutoras, etc.)"
465400,5400,Venta al por mayor de máquinas - herramienta de uso general
465500,5500,"Venta  al  por  mayor  de  vehículos,  equipos  y  máquinas  para  el transporte ferroviario, aéreo y de navegación"
465610,5610,Venta al por mayor de muebles e instalaciones para oficinas
465690,5690,"Venta al por mayor de muebles e instalaciones para la industria, el comercio y los servicios n.c.p."
465910,5910,Venta al por mayor de máquinas y equipo de control y seguridad
465920,5920,"Venta al por mayor de maquinaria y equipo de oficina, excepto equipo informático"
465930,5930,Venta al por mayor de equipo profesional y científico e instrumentos de medida y de control n.c.p.
465990,5990,"Venta al por mayor de máquinas, equipo y materiales conexos n.c.p."
466110,6110,Venta al por mayor de combustibles y lubricantes para automotores
466121,6121,Fraccionamiento y distribución de gas licuado
466129,6129,"Venta al por mayor de combustibles, lubricantes, leña y carbón, excepto gas licuado y combustibles y lubricantes para automotores"
466200,6200,Venta al por mayor de metales y minerales metalíferos
466310,6310,"Venta al por mayor de aberturas (Incluye puertas, ventanas, cortinas de enrollar, madera, aluminio, puertas corredizas, frentes de placard, etc.)"
466320,6320,"Venta al por mayor de productos de madera excepto muebles (Incluye placas, varillas, parqué, machimbre, etc.)"
466330,6330,"Venta al por mayor de artículos de ferretería y materiales eléctricos (Incluye la venta  de clavos, cerraduras, cable coaxil. etc)"
466340,6340,Venta al por mayor de pinturas y productos conexos
466350,6350,Venta al por mayor de cristales y espejos
466360,6360,"Venta al por mayor de artículos para plomería, instalación de gas y calefacción"
466370,6370,"Venta al por mayor de papeles para pared, revestimiento para pisos de goma, plástico y textiles,  y artículos similares para la decoración"
466391,6391,"Venta al por mayor de artículos de loza, cerámica y porcelana de uso en construcción"
466399,6399,Venta al por mayor de artículos para la construcción n.c.p. (No incluye artículos y materiales de demolición: 466990 )
466910,6910,"Venta al por mayor de productos intermedios n.c.p., desperdicios y desechos textiles"
466920,6920,"Venta al por mayor de productos intermedios n.c.p., desperdicios y desechos de papel y cartón"
466931,6931,Venta al por mayor de artículos de plástico
466932,6932,"Venta al por mayor de abonos, fertilizantes y plaguicidas"
466939,6939,"Venta al por mayor de productos intermedios, desperdicios y desechos de vidrio, caucho, goma y químicos n.c.p."
466940,6940,"Venta al por mayor de productos intermedios n.c.p., desperdicios y desechos metálicos (Incluye chatarra, viruta de metales diversos, etc.)"
466990,6990,"Venta al por mayor de productos intermedios, desperdicios y desechos n.c.p."
469010,9010,Venta al por mayor de insumos agropecuarios diversos
469090,9090,Venta al por mayor de mercancías n.c.p.
471110,1110,Venta al por menor en hipermercados
471120,1120,Venta al por menor en supermercados
471130,1130,"Venta al por menor en minimercados (Incluye mercaditos, autoservicios y establecimientos similares que vendan carnes, verduras y demás productos alimenticios en forma conjunta)"
471190,1190,"Venta al por menor en kioscos, polirrubros y comercios no especializados n.c.p."
471900,1900,"Venta al por menor en comercios no especializados, sin predominio de productos alimenticios y bebidas"
472111,2111,Venta al por menor de productos lácteos
472112,2112,Venta al por menor de fiambres y embutidos
472120,2120,Venta al por menor de productos de almacén y dietética
472130,2130,"Venta al por menor de carnes rojas, menudencias y chacinados frescos"
472140,2140,"Venta al por menor de huevos, carne de aves y  productos de granja y de la caza"
472150,2150,Venta al por menor de pescados y  productos de la pesca
472160,2160,"Venta al por menor de frutas, legumbres y hortalizas frescas"
472171,2171,Venta al por menor de pan y productos de panadería
472172,2172,"Venta al por menor de bombones, golosinas y demás productos de confitería"
472190,2190,"Venta al por menor de productos alimenticios n.c.p., en comercios especializados"
472200,2200,Venta al por menor de bebidas en comercios especializados
472300,2300,Venta al por menor de tabaco en comercios especializados
473000,3000,Venta al por menor de combustible para vehículos automotores y motocicletas (Incluye la venta al por menor de productos lubricantes y refrigerantes)
474010,4010,"Venta al por menor de equipos, periféricos,  accesorios y programas informáticos"
474020,4020,"Venta al por menor de aparatos de telefonía y comunicación (Incluye teléfonos, celulares, fax, etc)"
475110,5110,"Venta al por menor de hilados, tejidos y artículos de mercería (Incluye mercerías, sederías, comercios de venta de lanas y otros hilados, etc.) "
475120,5120,"Venta al por menor de confecciones para el hogar (Incluye la venta al por menor de sábanas, toallas, mantelería, cortinas confeccionadas, colchas, cubrecamas, etc.)"
475190,5190,"Venta al por menor de artículos textiles n.c.p. excepto prendas de vestir (Incluye la venta al por menor de tapices, alfombras,  etc.)"
475210,5210,"Venta al por menor de aberturas (Incluye puertas, ventanas, cortinas de enrollar de PVC, madera, aluminio, puertas corredizas, frentes de placards, etc.)"
475220,5220,"Venta al por menor de maderas y artículos de madera  y corcho, excepto muebles"
475230,5230,Venta al por menor de artículos de ferretería y materiales eléctricos
475240,5240,Venta al por menor de pinturas y productos conexos
475250,5250,Venta al por menor de artículos para plomería e instalación de gas
475260,5260,"Venta al por menor de cristales, espejos, mamparas y cerramientos"
475270,5270,"Venta al por menor de papeles para pared, revestimientos para pisos y artículos similares para la decoración"
475290,5290,Venta al por menor de materiales de construcción n.c.p.
475300,5300,"Venta al por menor  de electrodomésticos, artefactos para el hogar y equipos de audio y video"
475410,5410,"Venta al por menor de muebles para el hogar, artículos de mimbre y corcho"
475420,5420,Venta al por menor de colchones y somieres
475430,5430,Venta al por menor de artículos de iluminación
475440,5440,"Venta al por menor de artículos de bazar y menaje (Incluye venta al por menor de vajilla, cubiertos, etc.)"
475490,5490,"Venta al por menor de artículos para el hogar n.c.p. (Incluye perchas, marcos, cuadros, etc.)"
476110,6110,Venta al por menor de libros
476120,6120,Venta al por menor de diarios y revistas
476130,6130,"Venta al por menor de papel, cartón, materiales de embalaje y artículos de librería "
476200,6200,Venta al por menor de CD's y DVD's de audio y video grabados (Incluye CD's y DVD's vírgenes)
476310,6310,"Venta al por menor de equipos  y artículos deportivos (Incluye la venta y reparación  de bicicletas, la venta  de aparatos de gimnasia y de equipos de camping, etc.)  "
476320,6320,"Venta al por menor de armas, artículos para la caza y pesca"
476400,6400,"Venta al por menor de juguetes, artículos de cotillón y juegos de mesa"
477110,7110,"Venta al por menor de ropa interior, medias, prendas para dormir y para la playa (Incluye corsetería, lencería, camisetas, medias excepto ortopédicas, pijamas, camisones y saltos de cama, salidas de baño, trajes de baño, etc.)"
477120,7120,Venta al por menor de uniformes escolares y guardapolvos
477130,7130,Venta al por menor de indumentaria para bebés y niños
477140,7140,Venta al por menor de indumentaria deportiva
477150,7150,Venta al por menor de prendas de cuero
477190,7190,Venta al por menor de prendas y accesorios de vestir n.c.p.
477210,7210,"Venta al por menor de artículos de talabartería y artículos regionales (Incluye venta de artículos regionales de cuero, plata, alpaca y similares)"
477220,7220,"Venta al por menor de calzado, excepto el ortopédico y el deportivo (No incluye almacenes de suelas 464142)"
477230,7230,Venta al por menor de calzado deportivo
477290,7290,"Venta al por menor de artículos de marroquinería, paraguas y similares n.c.p."
477310,7310,Venta al por menor de productos farmacéuticos y de herboristería
477320,7320,"Venta al por menor de productos cosméticos, de tocador y de perfumería"
477330,7330,"Venta al por menor de instrumental médico y odontológico y artículos ortopédicos (Incluye venta de vaporizadores, nebulizadores, masajeadores, termómetros, prótesis, muletas, plantillas, calzado ortopédico y otros artículos similares de uso personal o doméstico)"
477410,7410,Venta al por menor de artículos de óptica y fotografía
477420,7420,Venta al por menor de artículos de relojería y joyería
477430,7430,Venta al por menor de bijouterie y fantasía
477440,7440,"Venta al por menor de flores, plantas, semillas, abonos, fertilizantes y otros productos de vivero "
477450,7450,Venta al por menor de materiales y productos de limpieza
477460,7460,"Venta al por menor de fuel oil, gas en garrafas, carbón y leña (No incluye las estaciones de servicios que se clasifican en 473000)"
477470,7470,"Venta al por menor de productos veterinarios, animales domésticos y alimento balanceado para mascotas"
477480,7480,Venta al por menor de obras de arte
477490,7490,"Venta al por menor de artículos nuevos n.c.p. (Incluye la venta realizada en casas de regalos, de artesanías, pelucas,  de artículos religiosos -santerías-, recarga de matafuegos,  etc.) "
477810,7810,Venta al por menor de muebles usados
477820,7820,"Venta al por menor de libros, revistas y similares usados"
477830,7830,Venta al por menor de antigüedades (Incluye venta de antigüedades en remates)
477840,7840,"Venta al por menor de oro, monedas, sellos y similares (Incluye la  venta de monedas de colección, estampillas, etc.) "
477890,7890,Venta al por menor de artículos usados n.c.p. excepto+E1155 automotores y motocicletas
478010,8010,"Venta al por menor de alimentos, bebidas y tabaco en puestos móviles y mercados"
478090,8090,Venta al por menor de productos n.c.p. en puestos móviles y mercados
479101,9101,Venta al por menor por internet
479109,9109,"Venta al por menor por correo, televisión y otros medios de comunicación n.c.p."
479900,9900,"Venta al por menor no realizada en establecimientos  n.c.p. (Incluye venta mediante máquinas expendedoras, vendedores ambulantes y vendedores a domicilio)"
491110,1110,Servicio de transporte ferroviario urbano y suburbano de pasajeros (Incluye el servicio de subterráneo y de premetro)
491120,1120,Servicio de transporte ferroviario interurbano de pasajeros
491200,1200,Servicio de transporte ferroviario de cargas
492110,2110,Servicio de transporte automotor urbano y suburbano regular de pasajeros
492120,2120,"Servicios de transporte automotor de pasajeros mediante taxis y remises, alquiler de autos con chofer (Incluye los radiotaxis)"
492130,2130,Servicio de transporte escolar (Incluye el servicio de transporte para colonias de vacaciones y clubes)
492140,2140,"Servicio de transporte automotor urbano y suburbano no regular de pasajeros de oferta libre,  excepto mediante taxis y remises, alquiler de autos con chofer y transporte escolar (Incluye servicios urbanos especiales como charters, servicios contratados, servicios para ámbito portuario o aeroportuario, servicio de hipódromos y espectáculos deportivos y culturales)"
492150,2150,"Servicio de transporte automotor interurbano regular de pasajeros, E1203excepto transporte internacional (Incluye los llamados servicios de larga distancia)"
492160,2160,Servicio de transporte automotor interurbano no regular de pasajeros
492170,2170,Servicio de transporte automotor internacional de pasajeros
492180,2180,Servicio de transporte automotor turístico de pasajeros
492190,2190,Servicio de transporte automotor de pasajeros n.c.p.
492210,2210,Servicios de mudanza (Incluye servicios de guardamuebles)
492221,2221,Servicio de transporte automotor de cereales
492229,2229,Servicio de transporte automotor de mercaderías a granel n.c.p.
492230,2230,Servicio de transporte automotor de animales
492240,2240,Servicio de transporte por camión cisterna
492250,2250,Servicio de transporte automotor de mercaderías y sustancias peligrosas
492280,2280,Servicio de transporte automotor urbano de carga n.c.p. (Incluye el transporte realizado por fleteros y distribuidores dentro del égido urbano)
492290,2290,Servicio de transporte automotor de cargas n.c.p. (Incluye  servicios de transporte de carga refrigerada y transporte pesado)
493110,3110,Servicio de transporte por oleoductos (Incluye estaciones de bombeo y compresión)
493120,3120,Servicio de transporte por poliductos y fueloductos
493200,3200,Servicio de transporte por gasoductos (Incluye estaciones de bombeo y compresión)
501100,1100,Servicio de transporte marítimo de pasajeros
501200,1200,Servicio de transporte marítimo de carga
502101,2101,Servicio de transporte fluvial y lacustre de pasajeros
502200,2200,Servicio de transporte fluvial y lacustre de carga
511000,1000,Servicio de transporte aéreo de pasajeros
512000,2000,Servicio de transporte aéreo de cargas
521010,1010,Servicios de manipulación de carga en el ámbito terrestre
521020,1020,Servicios de manipulación de carga en el ámbito portuario
521030,1030,Servicios de manipulación de carga en el ámbito aéreo
522010,2010,Servicios de almacenamiento y depósito en silos
522020,2020,Servicios de almacenamiento y depósito en cámaras frigoríficas
522091,2091,Servicios de usuarios directos de zona franca
522092,2092,Servicios de gestión de depósitos fiscales
522099,2099,Servicios de almacenamiento y depósito n.c.p.
523011,3011,Servicios de gestión aduanera realizados por despachantes de aduana
523019,3019,Servicios de gestión aduanera para el transporte de mercaderías n.c.p.
523020,3020,Servicios de agencias marítimas para el transporte de mercaderías
523031,3031,Servicios de gestión de agentes de transporte aduanero excepto agencias marítimas
523032,3032,Servicios de operadores logísticos seguros (OLS) en el ámbito aduanero
523039,3039,Servicios de operadores logísticos n.c.p.
523090,3090,"Servicios de gestión y logística para el transporte de mercaderías n.c.p. (Incluye las actividades de empresas empaquetadoras para comercio exterior, alquiler de contenedores, etc.)"
524110,4110,"Servicios de explotación de infraestructura para el transporte terrestre, peajes y otros derechos"
524120,4120,Servicios  de playas de estacionamiento y garajes
524130,4130,Servicios de estaciones terminales de ómnibus y ferroviárias
524190,4190,Servicios complementarios para el transporte terrestre n.c.p. (Incluye servicios de mantenimiento de material ferroviario)
524210,4210,"Servicios de explotación de infraestructura para el transporte marítimo, derechos de puerto"
524220,4220,Servicios de guarderías náuticas
524230,4230,"Servicios para la navegación (Incluye servicios de practicaje y pilotaje, atraque y salvamento)"
524290,4290,Servicios complementarios para el transporte marítimo n.c.p. (Incluye explotación de servicios de terminales como puertos y muelles)
524310,4310,"Servicios de explotación de infraestructura para el transporte aéreo, derechos de aeropuerto"
524320,4320,Servicios de hangares y estacionamiento de aeronaves
524330,4330,"Servicios para la aeronavegación (Incluye remolque de aeronaves y actividades de control de tráfico aéreo, etc.)"
524390,4390,Servicios complementarios para el transporte aéreo n.c.p. (Incluye servicios de prevención y extinción de incendios)
530010,10,Servicio de correo postal (Incluye las actividades de correo postal sujetas a la obligación de servicio universal)
530090,90,"Servicios de mensajerías (Incluye servicios puerta a puerta de correo y mensajería, comisionistas de encomiendas, transporte de documentos  realizados por empresas no sujetas a la obligación de servicio universal)"
551010,1010,Servicios de alojamiento por hora
551021,1021,Servicios de alojamiento en pensiones
551022,1022,"Servicios de alojamiento en hoteles, hosterías y residenciales similares, excepto por hora, que incluyen servicio de restaurante al público"
551023,1023,"Servicios de alojamiento en hoteles, hosterías y residenciales similares, excepto por hora, que no incluyen servicio de restaurante al público"
551090,1090,"Servicios de hospedaje temporal n.c.p. (Incluye hospedaje en estancias, residencias para estudiantes y albergues juveniles, apartamentos turísticos, etc.)"
552000,2000,Servicios de alojamiento en campings (Incluye refugios de montaña)
561011,1011,Servicios de restaurantes y cantinas sin espectáculo
561012,1012,Servicios de restaurantes y cantinas con espectáculo
561013,1013,"Servicios de """"fast food"""" y locales de venta de comidas y bebidas al paso (Incluye el expendio de hamburguesas, productos lácteos excepto helados, etc.) "
561014,1014,"Servicios de expendio de bebidas en bares (Incluye: bares, cervecerías, pubs, cafeterías)"
561019,1019,Servicios de expendio de comidas y bebidas en establecimientos con servicio de mesa y/o en mostrador n.c.p.
561020,1020,"Servicios de preparación de comidas para llevar (Incluye rotiserías, casas de empanadas, pizzerías sin consumo en el local) "
561030,1030,Servicio de expendio de helados
561040,1040,Servicios de preparación de comidas realizadas por/para vendedores ambulantes.
562010,2010,"Servicios de preparación de comidas para empresas y eventos (Incluye el servicio de catering, el suministro de comidas para banquetes, bodas, fiestas y otras celebraciones, comidas para hospital, etc.) "
562091,2091,Servicios de cantinas con atención exclusiva  a los empleados o estudiantes dentro de empresas o establecimientos educativos (Incluye cantinas deportivas)
562099,2099,Servicios de comidas n.c.p.
581100,1100,"Edición de libros, folletos, y otras publicaciones"
581200,1200,Edición de directorios y listas de correos
581300,1300,"Edición de periódicos, revistas y publicaciones periódicas"
581900,1900,Edición n.c.p.
591110,1110,Producción de filmes y videocintas
591120,1120,Postproducción de filmes y videocintas
591200,1200,Distribución de filmes y videocintas
591300,1300,Exhibición de filmes y videocintas
592000,2000,Servicios de grabación de sonido y edición de música
601000,1000,Emisión y retransmisión de radio
602100,2100,Emisión y retransmisión  de televisión abierta
602200,2200,Operadores de televisión por suscripción.
602310,2310,Emisión de señales de televisión por suscripción
602320,2320,Producción de programas de televisión
602900,2900,Servicios de televisión n.c.p
611010,1010,Servicios de locutorios
611090,1090,"Servicios de telefonía fija, excepto locutorios"
612000,2000,Servicios de telefonía móvil
613000,3000,"Servicios de telecomunicaciones vía satélite, excepto servicios de transmisión de televisión"
614010,4010,Servicios de proveedores de acceso a internet
614090,4090,Servicios de telecomunicación vía internet n.c.p.
619000,9000,Servicios de telecomunicaciones n.c.p. (Incluye el servicio de pagers)
620100,100,Servicios de consultores en informática y suministros de programas de informática
620200,200,Servicios de consultores en equipo de informática
620300,300,Servicios de consultores en tecnología de la información
620900,900,Servicios de informática n.c.p.
631110,1110,Procesamiento de datos
631120,1120,Hospedaje de datos
631190,1190,Actividades conexas al procesamiento y hospedaje de datos n.c.p.
631200,1200,Portales web
639100,9100,Agencias de noticias
639900,9900,Servicios de información n.c.p.
641100,1100,Servicios de la banca central (Incluye las actividades del Banco Central de la República Argentina)
641910,1910,Servicios de la banca mayorista
641920,1920,Servicios de la banca de inversión
641930,1930,Servicios de la banca minorista
641941,1941,Servicios de intermediación financiera realizada por las compañías financieras
641942,1942,Servicios de intermediación financiera realizada por sociedades de ahorro y préstamo para la vivienda y otros inmuebles
641943,1943,Servicios de intermediación financiera realizada por cajas de crédito
642000,2000,Servicios de sociedades de cartera
643001,3001,Servicios de fideicomisos
643009,3009,Fondos y sociedades de inversión y entidades financieras similares n.c.p.
649100,9100,"Arrendamiento financiero, leasing"
649210,9210,Actividades de crédito para financiar otras actividades económicas
649220,9220,Servicios de entidades de tarjeta de compra y/o crédito
649290,9290,"Servicios de crédito n.c.p. (Incluye el otorgamiento de préstamos por entidades que no reciben depósitos y que están fuera del sistema bancario y cuyo destino es financiar el consumo, la vivienda u otros bienes)"
649910,9910,"Servicios de agentes de mercado abierto """"puros"""" (Incluye las transacciones extrabursátiles - por cuenta propia -)"
649991,9991,"Servicios de socios inversores en sociedades regulares según Ley 19.550 - S.R.L., S.C.A, etc, excepto socios inversores en sociedades anónimas incluidos en 649999 (No incluye los servicios de socios miembros  que desarrollan actividades de asesoramiento, dirección y gestión empresarial de sociedades regulares según Ley 19.550: 702091 y 702092) "
649999,9999,"Servicios de financiación y actividades financieras n.c.p. (Incluye actividades de inversión en acciones, títulos, la actividad de corredores de bolsa, securitización, mutuales financieras, etc.), (No incluye actividades financieras relacionadas con el otorgamiento de créditos)"
651110,1110,Servicios de seguros de salud (Incluye medicina prepaga y mutuales de salud)
651120,1120,"Servicios de seguros de vida (Incluye los seguros de vida, retiro y sepelio)"
651130,1130,Servicios de seguros personales excepto  los de salud y de vida (Incluye los seguros para viajes)
651210,1210,Servicios de aseguradoras de riesgo de trabajo (ART)
651220,1220,Servicios de seguros patrimoniales excepto los de las aseguradoras de riesgo de trabajo (ART)
651310,1310,Obras Sociales
651320,1320,Servicios de cajas de previsión social pertenecientes a asociaciones profesionales
652000,2000,Reaseguros
653000,3000,"Administración de fondos de pensiones, excepto la seguridad social obligatoria"
661111,1111,Servicios de mercados y cajas de valores
661121,1121,Servicios de mercados a término
661131,1131,Servicios de bolsas de comercio
661910,1910,Servicios bursátiles de mediación o por cuenta de terceros (Incluye la actividad de agentes y sociedades de bolsa)
661920,1920,Servicios de casas y agencias de cambio
661930,1930,Servicios de sociedades calificadoras de riesgos financieros
661991,1991,Servicios de envio y recepción de fondos desde y hacia el exterior
661992,1992,Servicios de administradoras de vales y tickets
661999,1999,Servicios auxiliares a la intermediación financiera n.c.p. (Incluye asesoría financiera)
662010,2010,Servicios de evaluación de riesgos y daños
662020,2020,Servicios de productores  y asesores de seguros
662090,2090,Servicios auxiliares a los servicios de seguros n.c.p.
663000,3000,Servicios de gestión de fondos a cambio de una retribución o por contrata
681010,1010,"Servicios de alquiler y explotación de inmuebles para fiestas, convenciones y otros eventos similares "
681020,1020,Servicios de alquiler  de consultorios médicos
681098,1098,"Servicios inmobiliarios realizados por cuenta propia, con bienes urbanos propios o arrendados n.c.p."
681099,1099,"Servicios inmobiliarios realizados por cuenta propia, con bienes rurales propios o arrendados n.c.p."
682010,2010,Servicios de administración de consorcios de edificios
682091,2091,Servicios prestados por inmobiliarias
682099,2099,"Servicios inmobiliarios realizados a cambio de una retribución o por contrata n.c.p. (Incluye compra, venta, alquiler, remate, tasación, administración de bienes, etc., realizados a cambio de una retribución o por contrata, y la actividad de administradores, martilleros, rematadores, comisionistas, etc.)"
691001,1001,Servicios jurídicos
691002,1002,Servicios  notariales
692000,2000,"Servicios de contabilidad, auditoría y asesoría fiscal"
702010,2010,"Servicios de gerenciamiento de empresas e instituciones de salud, servicios de auditoria y medicina legal, servicio de asesoramiento farmacéutico "
702091,2091,"Servicios de asesoramiento, dirección y gestión empresarial realizados por integrantes de los órganos de administración y/o fiscalización en sociedades anónimas"
