clae6,clae3,Actividad
242090,2090,Fabricación de productos primarios de metales preciosos y metales no ferrosos n.c.p. y sus semielaborados
243100,3100,Fundición de hierro y acero
243200,3200,Fundición de metales no ferrosos
251101,1101,Fabricación de carpintería metálica
251102,1102,Fabricación de productos metálicos para uso estructural
251200,1200,"Fabricación de tanques, depósitos y recipientes de metal (Incluye la fabricación de silos)"
251300,1300,Fabricación de generadores de vapor
252000,2000,Fabricación de armas y municiones
259100,9100,"Forjado, prensado, estampado y laminado de metales, pulvimetalurgia"
259200,9200,Tratamiento y revestimiento de metales y trabajos de metales en general
259301,9301,Fabricación de herramientas manuales y sus accesorios
259302,9302,Fabricación de artículos de cuchillería y utensillos de mesa y de cocina
259309,9309,"Fabricación de cerraduras, herrajes y artículos de ferretería n.c.p."
259910,9910,Fabricación de envases metálicos
259991,9991,Fabricación de tejidos de alambre
259992,9992,Fabricación de cajas de seguridad
259993,9993,Fabricación de productos metálicos de tornería y/o matricería
259999,9999,Fabricación de productos elaborados de metal n.c.p.
261000,1000,Fabricación de componentes electrónicos
262000,2000,Fabricación de equipos y productos informáticos
263000,3000,Fabricación  de equipos de comunicaciones y transmisores de radio y televisión
264000,4000,"Fabricación de receptores de radio y televisión, aparatos de grabación y reproducción de sonido y video, y productos conexos"
265101,5101,"Fabricación de instrumentos y aparatos para medir, verificar, ensayar, navegar y otros fines, excepto el equipo de control de procesos industriales "
265102,5102,Fabricación de equipo de control de procesos industriales
265200,5200,Fabricación de relojes
266010,6010,"Fabricación de equipo médico y quirúrgico y de aparatos ortopédicos principalmente electrónicos y/o eléctricos (Incluye equipos de laboratorio, esterilizadores, paneles para observación de radiografías, tornos, etc.)"
266090,6090,"Fabricación de equipo médico y quirúrgico y de aparatos ortopédicos n.c.p. (Incluye prótesis, aparatos ortopédicos, materiales para fracturas, etc.)"
267001,7001,Fabricación de equipamiento e instrumentos ópticos y sus accesorios
267002,7002,"Fabricación de aparatos y accesorios para fotografía excepto películas, placas y papeles sensibles"
268000,8000,"Fabricación de soportes ópticos y magnéticos (Incluye CD, disquetes, cintas magnéticas, tarjetas magnetizadas, etc.)"
271010,1010,"Fabricación de motores, generadores y transformadores eléctricos"
271020,1020,Fabricación de aparatos de distribución y control de la energía eléctrica
272000,2000,"Fabricación de acumuladores, pilas y baterías primarias"
273110,3110,Fabricación de cables de fibra óptica
273190,3190,Fabricación de hilos y cables aislados n.c.p.
274000,4000,Fabricación de lámparas eléctricas y equipo de iluminación
275010,5010,"Fabricación de cocinas, calefones, estufas y calefactores no eléctricos"
275020,5020,"Fabricación de heladeras, freezers, lavarropas y secarropas"
275091,5091,"Fabricación de ventiladores, extractores de aire, aspiradoras y similares"
275092,5092,"Fabricación de planchas, calefactores, hornos eléctricos, tostadoras y otros aparatos generadores de calor"
275099,5099,"Fabricación de aparatos de uso doméstico n.c.p. (Incluye enceradoras, pulidoras, batidoras, licuadoras y similares)"
279000,9000,Fabricación  de equipo eléctrico n.c.p.
281100,1100,"Fabricación  de  motores  y  turbinas,  excepto  motores  para aeronaves, vehículos automotores   y motocicletas"
281201,1201,Fabricación de bombas
281301,1301,"Fabricación de compresores, grifos y válvulas"
281400,1400,"Fabricación de cojinetes, engranajes, trenes de engranaje y piezas de transmisión"
281500,1500,"Fabricación de hornos, hogares y quemadores"
281600,1600,"Fabricación de maquinaria y equipo de elevación y manipulación (Incluye la fabricación de ascensores, escaleras mecánicas, montacargas, etc.)"
281700,1700,"Fabricación de maquinaria y equipo de oficina, excepto equipo informático"
281900,1900,"Fabricación de  maquinaria y equipo de uso general n.c.p. (Incluye la fabricación de equipos de aire acondicionado, matafuegos, etc.)"
282110,2110,Fabricación de tractores
282120,2120,Fabricación de maquinaria y equipo de uso agropecuario y forestal
282130,2130,Fabricación de implementos de uso agropecuario
282200,2200,Fabricación de máquinas herramienta
282300,2300,Fabricación de maquinaria metalúrgica
282400,2400,"Fabricación de maquinaria para la explotación de minas y canteras y para obras de construcción (Incluye la fabricación de máquinas y equipos viales, equipos para la extracción de petróleo y gas, etc.)"
282500,2500,"Fabricación de maquinaria para la elaboración de alimentos, bebidas y tabaco"
282600,2600,"Fabricación de maquinaria para la elaboración de productos textiles, prendas de vestir y cueros"
282901,2901,Fabricación de maquinaria para la industria del papel y las artes gráficas
282909,2909,Fabricación de maquinaria y equipo de uso especial n.c.p.
291000,1000,Fabricación de vehículos automotores (Incluye la fabricación de motores para automotores)
292000,2000,"Fabricación de carrocerías para vehículos automotores, fabricación de remolques y semirremolques"
293011,3011,Rectificación de motores
293090,3090,"Fabricación de partes, piezas y accesorios para vehículos automotores y sus motores n.c.p."
301100,1100,Construcción y reparación de buques (Incluye construcción de estructuras flotantes)
301200,1200,Construcción y reparación de embarcaciones de recreo y deporte
302000,2000,Fabricación y reparación de locomotoras y de material rodante para transporte ferroviario
303000,3000,Fabricación y reparación de aeronaves
309100,9100,Fabricación de motocicletas
309200,9200,Fabricación de bicicletas y de sillones de ruedas ortopédicos
309900,9900,Fabricación de equipo de transporte n.c.p.
310010,10,"Fabricación de muebles y partes de muebles, principalmente de madera"
310020,20,"Fabricación de muebles y partes de muebles, excepto los que son principalmente de madera (metal, plástico, etc.)"
310030,30,Fabricación de somieres y colchones
321011,1011,Fabricación de joyas finas y artículos conexos
321012,1012,Fabricación de objetos de platería
321020,1020,Fabricación de bijouterie (Incluye la fabricación de joyas de fantasía y accesorios similares)
322001,2001,Fabricación de instrumentos de música
323001,3001,"Fabricación de artículos de deporte (Incluye equipos de deporte para gimnasia y campos de juegos, equipos de pesca y camping, etc., excepto indumentaria deportiva: 141040)"
324000,4000,Fabricación de juegos y juguetes
329010,9010,"Fabricación de lápices, lapiceras,  bolígrafos, sellos y artículos similares para oficinas y artistas"
329020,9020,"Fabricación de escobas, cepillos y pinceles "
329030,9030,"Fabricación de carteles, señales e indicadores  -eléctricos o no-"
329040,9040,"Fabricación de equipo de protección y seguridad, excepto calzado"
329090,9090,"Industrias manufactureras n.c.p. (Incluye fabricación de paraguas, termos, pelucas, etc.)"
331101,1101,"Reparación y mantenimiento de productos de metal, excepto maquinaria y equipo"
331210,1210,Reparación y mantenimiento de maquinaria de uso general
331220,1220,Reparación y mantenimiento de maquinaria y equipo de uso agropecuario y forestal
331290,1290,Reparación y mantenimiento de maquinaria de uso especial n.c.p.
331301,1301,"Reparación y mantenimiento de instrumentos médicos, ópticos y de precisión, equipo fotográfico, aparatos para medir, ensayar o navegar, relojes, excepto para uso personal o doméstico"
331400,1400,Reparación y mantenimiento de maquinaria y aparatos eléctricos
331900,1900,Reparación y mantenimiento de máquinas y equipo n.c.p.
332000,2000,Instalación de maquinaria y equipos industriales
351110,1110,"Generación de energía térmica convencional (Incluye la producción de energía eléctrica mediante máquinas turbo-gas, turbo vapor, ciclo combinado y turbo diesel)"
351120,1120,Generación de energía térmica nuclear (Incluye la producción de energía eléctrica mediante combustible nuclear)
351130,1130,Generación de energía hidráulica (Incluye la producción de energía eléctrica mediante centrales de bombeo)
351190,1190,"Generación de energía n.c.p. (Incluye la producción de energía eléctrica mediante fuentes de energía solar, biomasa, eólica, geotérmica, mareomotriz, etc.)"
351201,1201,Transporte de energía eléctrica
351310,1310,Comercio mayorista de energía eléctrica
351320,1320,Distribución de energía eléctrica
352010,2010,Fabricación de gas y procesamiento de gas natural
352020,2020,Distribución de combustibles gaseosos por tuberías (No incluye el transporte por gasoductos)
353001,3001,Suministro de vapor y aire acondicionado
360010,10,"Captación, depuración y distribución de agua de fuentes subterráneas"
360020,20,"Captación, depuración y distribución de agua de fuentes superficiales"
370000,0,"Servicios de depuración de aguas residuales, alcantarillado y cloacas"
381100,1100,"Recolección, transporte, tratamiento y disposición final de residuos no peligrosos"
381200,1200,"Recolección, transporte, tratamiento y disposición final de residuos peligrosos"
382010,2010,Recuperación de materiales y desechos metálicos
382020,2020,Recuperación de materiales y desechos no metálicos
390000,0,Descontaminación y otros servicios de gestión de residuos
410011,11,"Construcción, reforma y reparación de edificios residenciales (Incluye la construcción, reforma y reparación  de viviendas unifamiliares y multifamiliares, bungaloes, cabañas, casas de campo, departamentos, albergues para ancianos, niños, estudiantes, etc.)"
410021,21,"Construcción, reforma y reparación de edificios no residenciales (Incluye construcción, reforma y reparación de restaurantes, bares, campamentos, bancos, oficinas, galerías comerciales, estaciones de servicio, edificios para tráfico y comunicaciones, garajes, edificios industriales y depósitos, escuelas, etc.)"
421000,1000,"Construcción, reforma y reparación de obras de infraestructura para el transporte (Incluye la construcción, reforma y reparación de calles, autopistas, carreteras, puentes, túneles, vías férreas y pistas de aterrizaje, la señalización mediante pintura, etc.)"
422100,2100,Perforación de pozos de agua
422200,2200,"Construcción, reforma y reparación de redes distribución de electricidad, gas, agua, telecomunicaciones y de otros servicios públicos"
429010,9010,"Construcción, reforma y reparación de obras hidráulicas (Incluye obras fluviales y canales, acueductos, diques, etc.)"
429090,9090,"Construcción de obras de ingeniería civil n.c.p. (Incluye los trabajos generales de construcción para la minería y la industria,  de centrales eléctricas y nucleares, excavaciones de sepulturas, etc.)"
431100,1100,"Demolición y voladura de edificios y de sus partes (Incluye los trabajos de limpieza de escombros asociada a la demolición, los derribos y demolición de edificios y obras de ingeniería civil,.los trabajos de voladura y remoción de rocas) "
431210,1210,"Movimiento de suelos y preparación de terrenos para obras (Incluye el drenaje, excavación de zanjas para construcciones diversas, el despeje de capas superficiales no contaminadas, movimientos de tierras para hacer terraplenes o desmontes previos a la construcción de vías, carreteras, autopistas, FFCC, etc.)"
431220,1220,"Perforación y sondeo, excepto perforación de pozos de petróleo, de gas, de minas e hidráulicos  y prospección de yacimientos de petróleo (Incluye los trabajos de perforación, sondeo y muestreo con fines de construcción o para estudios geofísicos, geológicos u otros similares, las perforaciones horizontales para el paso de cables o cañerías de drenaje, etc.), (No incluye los servicios de perforación relacionados con la extracción de petróleo y gas, activ.091000, ni la perforación de pozos hidráulicos, activ.422100)"
432110,2110,"Instalación de sistemas de iluminación, control y señalización eléctrica para el transporte "
432190,2190,"Instalación, ejecución y mantenimiento de instalaciones eléctricas, electromecánicas y electrónicas n.c.p. (Incluye la instalación de antenas, pararrayos, sistemas de alarmas contra incendios y robos, sistemas de telecomunicación, etc.)"
432200,2200,"Instalaciones de gas, agua, sanitarios y de climatización, con sus artefactos conexos (Incluye la instalación de compactadores, calderas, sistemas de calefacción central, etc.)"
432910,2910,"Instalaciones de ascensores, montacargas y  escaleras mecánicas"
432920,2920,"Aislamiento térmico, acústico, hídrico y antivibratorio"
432990,2990,Instalaciones para edificios y obras de ingeniería civil n.c.p. (Incluye instalación de puertas automáticas o giratorias)
433010,3010,"Instalaciones de carpintería, herrería de obra y artística (Incluye instalación de puertas y ventanas, carpintería metálica y no metálica, etc.)"
433020,3020,"Terminación y revestimiento de paredes y pisos (Incluye yesería, salpicré, el pulido de pisos y la colocación de revestimientos de cerámicas, de piedra tallada, de suelos flexibles, parqué, baldosas, empapelados, etc.)"
433030,3030,"Colocación de cristales en obra (Incluye la instalación y revestimiento de vidrio, espejos y otros artículos de vidrio, etc.)"
433040,3040,Pintura y trabajos de decoración
433090,3090,"Terminación de edificios n.c.p. (Incluye trabajos de ornamentación, limpieza exterior de edificios recién construídos, etc.)"
439100,9100,Alquiler de equipo de construcción o demolición dotado de operarios
439910,9910,"Hincado de pilotes, cimentación y otros trabajos de hormigón armado"
439990,9990,"Actividades especializadas de construcción n.c.p. (Incluye el alquiler, montaje y desmantelamiento de andamios,  la construcción de chimeneas y hornos industriales, el acorazamiento de cajas fuertes y cámaras frigoríficas, el armado e instalación de compuertas para diques, etc.)"
451110,1110,"Venta de autos, camionetas y utilitarios nuevos (Incluye taxis, jeeps, 4x4 y vehículos similares)"
451190,1190,"Venta de vehículos automotores nuevos n.c.p. (Incluye casas rodantes, trailers, camiones, remolques, ambulancias, ómnibus, microbuses y similares, cabezas tractoras, etc.)"
451210,1210,"Venta de autos, camionetas y utilitarios, usados (Incluye taxis, jeeps, 4x4 y vehículos similares)"
451290,1290,"Venta de vehículos automotores usados n.c.p. (Incluye, casas rodantes, trailers, camiones, remolques, ambulancias, ómnibus, microbuses y similares, cabezas tractoras, etc.)"
452101,2101,Lavado automático y manual de vehículos automotores
452210,2210,Reparación de cámaras y cubiertas (Incluye reparación de llantas)
452220,2220,"Reparación de amortiguadores,  alineación de dirección y balanceo de ruedas "
452300,2300,"Instalación y reparación de parabrisas, lunetas y ventanillas, cerraduras no eléctricas y grabado de cristales (Incluye instalación y reparación de aletas, burletes y colisas)"
452401,2401,"Reparaciones eléctricas del tablero e instrumental, reparación y recarga de baterías, instalación de alarmas, radios, sistemas de climatización"
452500,2500,Tapizado y retapizado de automotores
452600,2600,"Reparación y pintura de carrocerías, colocación y reparación de guardabarros y protecciones exteriores"
452700,2700,Instalación y reparación de caños de escape y radiadores
452800,2800,Mantenimiento y reparación de frenos y embragues
452910,2910,Instalación y reparación de equipos de GNC
452990,2990,"Mantenimiento y reparación del motor n.c.p., mecánica integral (Incluye auxilio y servicios de grúa para automotores) "
453100,3100,"Venta al por mayor de partes, piezas y accesorios de vehículos automotores"
453210,3210,Venta al por menor de cámaras y cubiertas
453220,3220,Venta al por menor de baterías
453291,3291,"Venta al por menor de partes, piezas y accesorios nuevos n.c.p."
453292,3292,"Venta al por menor de partes, piezas y accesorios usados n.c.p."
454010,4010,"Venta de motocicletas y de sus partes, piezas y accesorios"
454020,4020,Mantenimiento y reparación de motocicletas
461011,1011,"Venta al por mayor en comisión o consignación de cereales (incluye arroz), oleaginosas y forrajeras excepto semillas"
461012,1012,Venta al por mayor en comisión o consignación de semillas
461013,1013,Venta al por mayor en comisión o consignación de frutas (Incluye acopiadores y receptoras)
461014,1014,"Acopio y acondicionamiento en comisión o consignación de cereales (incluye arroz), oleaginosas y forrajeras excepto semillas"
461019,1019,Venta al por mayor en comisión o consignación de productos agrícolas n.c.p.
461021,1021,Venta al por mayor en comisión o consignación de ganado bovino en pie (Incluye consignatarios de hacienda y ferieros)
461022,1022,Venta al por mayor en comisión o consignación de ganado en pie excepto bovino
461029,1029,Venta al por mayor en comisión o consignación de productos pecuarios n.c.p.
461031,1031,Operaciones de intermediación de carne - consignatario directo -
461032,1032,"Operaciones de intermediación de carne excepto consignatario directo (Incluye matarifes abastecedores de carne, etc.)"
461039,1039,"Venta al por mayor en comisión o consignación de alimentos, bebidas y tabaco n.c.p."
461040,1040,Venta al por mayor en comisión o consignación de combustibles (No incluye electricidad)
461091,1091,"Venta al por mayor en comisión o consignación de productos textiles, prendas de vestir, calzado excepto el ortopédico,  artículos de marroquinería, paraguas y similares y productos de cuero n.c.p."
461092,1092,Venta al por mayor en comisión o consignación de  madera y materiales para la construcción
461093,1093,"Venta al por mayor en comisión o consignación de minerales, metales y productos químicos industriales"
461094,1094,"Venta al por mayor en comisión o consignación de  maquinaria, equipo profesional industrial y comercial, embarcaciones y aeronaves"
461095,1095,"Venta al por mayor en comisión o consignación de papel, cartón, libros, revistas, diarios, materiales de embalaje y artículos de librería"
461099,1099,Venta al por mayor en comisión o consignación de  mercaderías n.c.p.
462110,2110,Acopio de algodón
462120,2120,Venta al por mayor de semillas y granos para forrajes
462131,2131,"Venta al por mayor de cereales (incluye arroz), oleaginosas y forrajeras excepto semillas"
462132,2132,"Acopio y acondicionamiento de cereales y semillas, excepto de algodón y semillas y granos para forrajes"
462190,2190,"Venta al por mayor de materias primas agrícolas y de la silvicultura n.c.p. (Incluye el acopio y venta al por mayor de materiles, desperdicios, subproductos agrícola usados como alimentos para animales)"
462201,2201,"Venta al por mayor de lanas, cueros en bruto y productos afines"
462209,2209,Venta al por mayor de materias primas pecuarias n.c.p. incluso animales vivos (Incluye pieles y cueros en bruto)
463111,3111,Venta al por mayor de productos lácteos
463112,3112,Venta al por mayor de fiambres y quesos
463121,3121,Venta al por mayor de carnes rojas y derivados (Incluye abastecedores y distribuidores de carne)
463129,3129,"Venta al por mayor de aves, huevos y productos de granja y de la caza n.c.p. (Incluye la venta al por mayor  de carne de ave fresca, congelada o refrigerada)"
463130,3130,Venta al por mayor de pescado
463140,3140,"Venta al por mayor y empaque de frutas, de legumbres y hortalizas frescas"
463151,3151,"Venta al por mayor de pan, productos de confitería y pastas frescas"
463152,3152,Venta al por mayor de azúcar
463153,3153,Venta al por mayor de aceites y grasas
463154,3154,"Venta al por mayor de café, té, yerba mate y otras infusiones y especias y condimentos (Incluye la venta de sal)"
463159,3159,Venta al por mayor de productos y subproductos de molinería n.c.p.
463160,3160,"Venta al por mayor de chocolates, golosinas y productos para kioscos y polirrubros n.c.p., excepto cigarrillos"
463170,3170,Venta al por mayor de alimentos balanceados para animales
463180,3180,Venta al por mayor en supermercados mayoristas de alimentos
463191,3191,"Venta al por mayor de frutas, legumbres y cereales secos y en conserva"
463199,3199,"Venta al por mayor de productos alimenticios n.c.p. (Incluye la venta de miel y derivados, productos congelados,  etc.)"
463211,3211,Venta al por mayor de vino
463212,3212,Venta al por mayor de bebidas espiritosas
463219,3219,"Venta al por mayor de bebidas alcohólicas n.c.p. (Incluye la venta de aperitivos con alcohol, cerveza, sidra, etc.)"
463220,3220,"Venta al por mayor de bebidas no alcohólicas (Incluye la venta de aguas, sodas, bebidas refrescantes, jarabes, extractos, concentrados, gaseosas, jugos, etc.)"
463300,3300,Venta al por mayor de cigarrillos y productos de tabaco
464111,4111,Venta al por mayor de tejidos (telas)
464112,4112,"Venta al por mayor de artículos de mercería (Incluye la venta de puntillas, galones, hombreras, agujas, botones, etc.)"
464113,4113,"Venta al por mayor de mantelería, ropa de cama y artículos textiles para el hogar"
464114,4114,Venta al por mayor de tapices y alfombras de materiales textiles
464119,4119,Venta al por mayor de productos textiles n.c.p.
464121,4121,Venta al por mayor de prendas de vestir de cuero
464122,4122,Venta al por mayor de medias y prendas de punto
464129,4129,"Venta al por mayor de prendas y accesorios de vestir n.c.p., excepto uniformes y ropa de trabajo"
464130,4130,"Venta al por mayor de calzado excepto el ortopédico (Incluye venta de calzado de cuero, tela, plástico, goma, etc.)"
464141,4141,Venta al por mayor de pieles y cueros curtidos y salados
464142,4142,"Venta al por mayor de suelas y afines (Incluye talabarterías, artículos regionales de cuero, almacenes de suelas, etc.)"
464149,4149,"Venta al por mayor de artículos de marroquinería,  paraguas y productos similares n.c.p."
464150,4150,Venta al por mayor de uniformes y ropa de trabajo
464211,4211,Venta al por mayor de libros y publicaciones
464212,4212,Venta al por mayor de diarios y revistas
464221,4221,Venta al por mayor de papel y productos de papel y cartón excepto envases
464222,4222,Venta al por mayor de envases de papel y cartón
464223,4223,Venta al por mayor de artículos de librería y papelería
464310,4310,"Venta al por mayor de productos farmacéuticos (Incluye venta de medicamentos y kits de diagnóstico como test de embarazo, hemoglucotest, vacunas, etc.)"
464320,4320,"Venta al por mayor de productos cosméticos, de tocador y de perfumería (Incluye venta de artículos para peluquería excepto equipamiento)"
464330,4330,"Venta al por mayor de instrumental médico y odontológico y artículos ortopédicos (Incluye venta de vaporizadores, nebulizadores, masajeadores, termómetros, prótesis, muletas, plantillas, calzado ortopédico y otros artículos similares de uso personal o doméstico)"
464340,4340,Venta al por mayor de productos veterinarios
464410,4410,"Venta al por mayor de artículos de óptica y de fotografía (Incluye venta de lentes de contacto, líquidos oftalmológicos, armazones, cristales ópticos, películas fotográficas, cámaras y accesorios para fotografía, etc.)"
464420,4420,"Venta al por mayor de artículos de relojería, joyería y fantasías"
464501,4501,Venta al por mayor de electrodomésticos y artefactos para el hogar excepto equipos de audio y video
464502,4502,"Venta al por mayor de equipos de audio, video y televisión"
464610,4610,"Venta al por mayor de muebles excepto de oficina, artículos de mimbre y corcho, colchones y somieres"
464620,4620,Venta al por mayor de artículos de iluminación
464631,4631,Venta al por mayor de artículos de vidrio
464632,4632,Venta al por mayor de artículos de bazar y menaje excepto de vidrio
464910,4910,Venta al por mayor de CD's y DVD's de audio y video grabados.
464920,4920,Venta al por mayor de materiales y productos de limpieza
464930,4930,Venta al por mayor de juguetes (Incluye artículos de cotillón)
464940,4940,"Venta al por mayor de bicicletas y rodados similares (Incluye cochecitos y sillas de paseo para bebés, andadores, triciclos, etc.)"
464950,4950,"Venta al por mayor de artículos de esparcimiento y deportes (Incluye embarcaciones deportivas, armas y municiones, equipos de pesca, piletas de natación de lona o plástico, etc.)"
464991,4991,Venta al por mayor de flores y plantas naturales y artificiales
464999,4999,"Venta al por mayor de artículos de uso doméstico o personal n.c.p (Incluye artículos de platería excepto los incluidos en talabartería, cuadros y marcos que no sean obra de arte o de colección, sahumerios y artículos de santería, parrillas y hogares, etc.)"
465100,5100,"Venta al por mayor de equipos, periféricos, accesorios y programas informáticos"
465210,5210,Venta al por mayor de equipos de telefonía y comunicaciones
465220,5220,Venta al por mayor de componentes electrónicos
465310,5310,"Venta al por mayor de máquinas, equipos e implementos de uso en los sectores agropecuario, jardinería, silvicultura, pesca y caza (Incluye venta de tractores, cosechadoras, enfardadoras, remolques de carga y descarga automática, motosierras, cortadoras de césped autopropulsadas, etc.)"
465320,5320,"Venta al por mayor de máquinas, equipos e implementos de uso en la elaboración de alimentos, bebidas y tabaco (Incluye máquinas para moler, picar y cocer alimentos, fabricadora de pastas, bateas, enfriadoras y envasadoras de bebidas, etc.)"
